{
  "title": "Has label, no spawn, no func param",
  "targets": [
    "spawnerlabel"
  ],
  "level": "evil",
  "variants": {
    "good": null,
    "bad": {
      "description": "Method has unnecessary spawner label",
      "functions": {
        "spawnerlabel": "unnecessaryLabelOnMethod"
      }
    }
  }
}
