{
  "title": "Ctx only in IIFE nested closure (LIMITATION)",
  "targets": [
    "goroutine"
  ],
  "variants": {
    "bad": {
      "description": "Known analyzer limitation: this pattern cannot be detected statically.",
      "functions": {
        "goroutine": "badIIFEUsesCtxInNestedFunc"
      }
    },
    "good": null
  },
  "level": "evil"
}
