{
  "title": "Only creates group but doesn't spawn",
  "targets": [
    "spawnerlabel"
  ],
  "level": "evil",
  "variants": {
    "good": {
      "description": "Creates errgroup but no spawn calls",
      "functions": {
        "spawnerlabel": "onlyCreateGroup"
      }
    },
    "bad": null
  }
}
