{
  "title": "Edge case: Context param with unusual name",
  "targets": [
    "gotask"
  ],
  "variants": {
    "bad": {
      "description": "Context parameter with non-standard naming is detected.",
      "functions": {
        "gotask": "badContextParamUnusualName"
      }
    },
    "good": null
  },
  "level": "evil"
}
