{
  "title": "Higher-order func",
  "targets": [
    "errgroup",
    "waitgroup"
  ],
  "level": "evil",
  "variants": {
    "good": {
      "description": "Factory function is called with context, enabling propagation.",
      "functions": {
        "errgroup": "goodHigherOrderFuncWithCtx",
        "waitgroup": "goodHigherOrderFuncWithCtx"
      }
    },
    "bad": {
      "description": "Function returned by factory does not use context.",
      "functions": {
        "errgroup": "badHigherOrderFunc",
        "waitgroup": "badHigherOrderFunc"
      }
    }
  }
}
