{
  "title": "DoAllSettled - NewTask with deriver",
  "targets": [
    "gotask"
  ],
  "variants": {
    "good": {
      "description": "Task function properly calls the context deriver.",
      "functions": {
        "gotask": "goodDoAllSettledNewTaskWithDeriver"
      }
    },
    "bad": {
      "description": "DoAllSettled - NewTask without deriver",
      "functions": {
        "gotask": "badDoAllSettledNewTaskNoDeriver"
      }
    }
  },
  "level": "basic"
}
