{
  "title": "Arbitrary depth go fn()()...()",
  "targets": [
    "goroutine"
  ],
  "level": "evil",
  "variants": {
    "good": {
      "description": "Arbitrary depth go fn(ctx)()()...() with ctx",
      "functions": {
        "goroutine": "goodGoInfiniteChain"
      }
    },
    "bad": {
      "description": "Arbitrary depth go fn()()()...() without ctx",
      "functions": {
        "goroutine": "badGoInfiniteChain"
      }
    }
  }
}
