{
  "title": "AND - Defer pattern",
  "targets": [
    "goroutinederiveand"
  ],
  "level": "advanced",
  "variants": {
    "good": {
      "description": "AND - defer with both derivers.",
      "functions": {
        "goroutinederiveand": "goodAndDeferWithBothDerivers"
      }
    },
    "bad": {
      "description": "AND - defer with only one deriver.",
      "functions": {
        "goroutinederiveand": "badAndDeferWithOneDeriver"
      }
    }
  }
}
