{
  "title": "Higher-order returns reassigned variable - with ctx",
  "targets": [
    "conc",
    "errgroup",
    "goroutine",
    "waitgroup"
  ],
  "level": "evil",
  "variants": {
    "good": {
      "description": "Factory function returns a reassigned variable that captures context.",
      "functions": {
        "errgroup": "goodHigherOrderReturnsReassignedVariableWithCtx",
        "goroutine": "goodHigherOrderReturnsReassignedVariableWithCtx",
        "waitgroup": "goodHigherOrderReturnsReassignedVariableWithCtx",
        "conc": "goodHigherOrderReturnsReassignedVariableWithCtx"
      }
    }
  }
}
