{
  "title": "Properly labeled function with spawn call",
  "targets": [
    "spawnerlabel"
  ],
  "level": "basic",
  "variants": {
    "good": {
      "description": "Function has spawner label and spawn call",
      "functions": {
        "spawnerlabel": "goodProperlyLabeled"
      }
    },
    "bad": null
  }
}
