{
  "title": "Mixed - OR alternative only in nested IIFE.",
  "targets": [
    "goroutinederivemixed"
  ],
  "variants": {
    "good": {
      "description": "Satisfies the mixed requirement via OR alternative path.",
      "functions": {
        "goroutinederivemixed": "goodMixedOrAlternativeInNestedIIFE"
      }
    },
    "bad": null
  },
  "level": "evil"
}
