{
  "title": "Go call inside inner named func without ctx",
  "targets": [
    "errgroup",
    "waitgroup"
  ],
  "variants": {
    "bad": {
      "description": "Go call in nested function does not use the outer context.",
      "functions": {
        "errgroup": "badNestedInnerFunc",
        "waitgroup": "badNestedInnerFunc"
      }
    },
    "good": null
  },
  "level": "advanced"
}
