{
  "title": "Chained task creation",
  "targets": [
    "gotask"
  ],
  "variants": {
    "bad": {
      "description": "Chained task creation - DoAsync on result of method chain",
      "functions": {
        "gotask": "badChainedTaskDoAsync"
      }
    },
    "good": null
  },
  "level": "evil"
}
