{
  "title": "Goroutine in for loop with ctx",
  "targets": [
    "goroutine"
  ],
  "variants": {
    "good": {
      "description": "Goroutines in loop properly capture and use context.",
      "functions": {
        "goroutine": "goodGoroutinesInLoopWithCtx"
      }
    },
    "bad": null
  },
  "level": "advanced"
}
