{
  "title": "go fn()()() - triple higher-order",
  "targets": [
    "goroutine"
  ],
  "level": "evil",
  "variants": {
    "good": {
      "description": "Three levels of function invocation with context propagation.",
      "functions": {
        "goroutine": "goodGoHigherOrderTriple"
      }
    },
    "bad": {
      "description": "Three levels of function invocation without context propagation.",
      "functions": {
        "goroutine": "badGoHigherOrderTriple"
      }
    }
  }
}
