{
  "title": "Variable func",
  "targets": [
    "errgroup",
    "waitgroup"
  ],
  "level": "evil",
  "variants": {
    "good": {
      "description": "Function stored in variable captures and uses context.",
      "functions": {
        "errgroup": "goodVariableFuncWithCtx",
        "waitgroup": "goodVariableFuncWithCtx"
      }
    },
    "bad": {
      "description": "Function stored in variable does not capture context.",
      "functions": {
        "errgroup": "badVariableFunc",
        "waitgroup": "badVariableFunc"
      }
    }
  }
}
