{
  "title": "Shadow with non-ctx type - string",
  "targets": [
    "goroutine",
    "errgroup",
    "waitgroup"
  ],
  "variants": {
    "bad": {
      "description": "Shadow with non-ctx type (string)",
      "functions": {
        "goroutine": "badShadowingNonContext",
        "errgroup": "badShadowingNonContext",
        "waitgroup": "badShadowingNonContext"
      }
    },
    "good": null
  },
  "level": "basic"
}
