{
  "title": "Basic - has own context param.",
  "targets": [
    "goroutinederive"
  ],
  "variants": {
    "notChecked": {
      "description": "Function declares its own context parameter, so outer context not required.",
      "functions": {
        "goroutinederive": "notCheckedOwnContextParam"
      }
    }
  },
  "level": "goroutinederive"
}
